listing_id,id,date,reviewer_id,reviewer_name,comments
3038772,58207396,2016-01-01,14638343,Linda,"Lisa was an absolute sweetheart, checking in with me regularly to make sure I had everything I needed. 

Her place is cozy and bright. Everything was clean and well thought out. Lisa has clear instructions and notes everywhere to really make you feel at home. Little touches like a pitcher of filtered water in the fridge and extra blankets in a basket near the bed really made it a nice experience. 

The house is centrally located, and I was able to walk to tons of great restaurants, coffee shops, and shopping on Ballard Ave. 

I would highly recommend this spot for a visit to the lovely city of Seattle. "
9068419,58309477,2016-01-02,47512321,Dongwoo,"Hugo is so kind person and the studio was nice and cozy. We could find the studio easily. it is convenient for transportation and shopping. We took for a walk in a park near the studio every day. If I go to the Seattle, I'd like to stay the Hugo's again."
-975179,58224198,2016-01-01,50874405,Hayley,House was very clean and nice. Exactly what we were looking for for the night! Thanks Katie!
6746826,58208873,2016-01-01,37599863,Jordan,Gracie and Phuong were great hosts. We got a nice tour of the place and knew that if needed they would be on the call. Would definitely rent again from them. 
2211594,58379973,2016-01-02,36086525,Ruby,"Our stay here was fantastic. Everything in the place was just as described and it was really nice to feel like we were in a home, but not encrouching on anyone's space. We were able to walk to great places nearby, take busses to other neighborhoods, and find parking for the car without a problem. We took advantage of Trader Joe's and the full kitchen to make many home cooked meals. Thank you for providing such a wonderful place and for checking in to make sure everything was going smoothly. Oh, and the key pad was really convenient. No worries about who had the keys. Thank you very much for a wonderful stay!
"
-5978216,58222979,2016-01-01,18708107,Jessica,"Marlee's place is cozy and every little things in her house has stories. Marlee is very cool person and very warm hearted.
Her house is very close to a nice convenience store and the bus stop to downtown. The room listed is warm and the queen bed is comfortable."
-8684315,58556005,2016-01-03,22458644,Susie,"We had the pleasure of meeting Mike, Paulina and, of course, Barksdale, the friendly Golden-Doodle.  The home is lovely and is convenient to coffee shops, restaurants and nice views of the city.  We used UBER to get around which worked great.

We felt very welcome in this home and enjoyed spending time in Seattle.

We would definitely refer this property and are happy to have met both Mike and Paulina."
7967844,58237949,2016-01-01,7380813,Tristan & Sinead,"A lovely place in a quiet and residential area of Seattle with great views of the city. The suite is spacious, with a living area that is flooded with natural light due to the many windows. 

Would stay again."
-6856295,58232590,2016-01-01,14061660,Brock,"Great location, new clean & private room. Didn't get to meet our hosts, but they made it very easy for us to get into the room and they were very accommodating.  I would highly recommend a stay here for anyone looking for accommodations in the Ballard area"
-2660384,58171480,2016-01-01,31316861,Tanar,"Easy to find and easy to get to, we hit a snag when the front door wouldn't unlock. Luckily, the housekeeper was walking by and between him and a call to Michael, we managed to get the door unstuck. Michael was very apologetic about the door and hopefully, by the time you read this, he's gotten it fixed like he hoped.

Inside the apartment looked exactly like the photos although less white and more beige. It's spacious, quiet, and warm. The bed is probably the most comfortable bed I've ever slept on in my life. Slept like a rock. 

It was a very cold night so we Uber'd to the Space Needle but walked back. In the morning, we walked to The Market as well. Everything's close and easy to get to. 

We never got to meet Blake Lively though. Ah well."
8372562,58131030,2016-01-01,35055441,Jeannie,"We had an amazing time staying at Jon's home, the house is very spacious and in a great location with views that I wish I woke up to everyday Stunning!
Jon was quick to respond to all my questions and very accommodating with my request re check in time.
Everything in the house was as described and great hot tub with a view of Mount Rainier by day and a beautiful view of Bellevue skyline by night.
All in all we had a fab Christmas in Seattle. X "
